{
  "$schema": "https://asui.dev/schemas/workflow_config.schema.json",
  "version": "v1.0",
  "name": "LifeWake Runtime Workflow",
  "description": "同意门禁 → 惊喜/心跳创作 → 仪式渲染 → 报告",
  "swarm": {
    "mode": "lifewake-emotional-cocreation",
    "methodology": "emotion-alchemy-bond-privacy",
    "decision_policy": "consent-governed-slow-inspiration",
    "agents": [
      {"id": "intent_guard", "name": "意图守恒智能体", "dimension": "intent"},
      {"id": "privacy_steward", "name": "隐私领土守卫", "dimension": "governance"},
      {"id": "signal_weaver", "name": "信号编织者", "dimension": "knowledge"},
      {"id": "surprise_alchemist", "name": "惊喜炼金师", "dimension": "agent"},
      {"id": "pulse_composer", "name": "心跳作曲家", "dimension": "agent"},
      {"id": "bond_guardian", "name": "关系编织守卫", "dimension": "governance"},
      {"id": "ritual_host", "name": "仪式主持", "dimension": "system"},
      {"id": "evolution_listener", "name": "演化倾听者", "dimension": "evolution"}
    ]
  },
  "steps": [
    {
      "id": "intent_activation",
      "name": "情感意图激活",
      "type": "llm",
      "agent_id": "intent_guard",
      "prompt_template": "归一化生命回响意图（惊喜盲盒 / 心跳共鸣），明确目标、约束、对象与成功标准（含情感冲击）。\n\n{{topic}}"
    },
    {
      "id": "governance_check",
      "name": "隐私与同意治理校验",
      "type": "llm",
      "dependencies": ["intent_activation"],
      "agent_id": "privacy_steward"
    },
    {
      "id": "lifewake_execute",
      "name": "生命回响闭环执行",
      "type": "script",
      "dependencies": ["governance_check"],
      "script": "scripts/run_lifewake_pipeline.py"
    },
    {
      "id": "render_report",
      "name": "写入仪式报告",
      "type": "script",
      "dependencies": ["lifewake_execute"],
      "script": "scripts/render_lifewake_report.py"
    }
  ]
}
